{
  "kind": "cineweave_codex_style_review",
  "contractVersion": "2.0.0",
  "reviewId": "style-review-song-portrait-01",
  "stylePackageRef": { "id": "song-poetic-period-drama", "version": 1, "contentHash": "sha256:aaaaaaaaaaaaaaaaaaaaaaaaaaaaaaaaaaaaaaaaaaaaaaaaaaaaaaaaaaaaaaaa" },
  "candidateObservationIds": ["obs.candidate.song.portrait.01"],
  "dimensions": [
    { "dimensionId": "medium", "status": "pass", "score": 9, "evidenceObservationIds": ["obs.candidate.song.portrait.01"], "evidence": "画面保持真人摄影的皮肤、服装和光线响应。" },
    { "dimensionId": "culture_costume", "status": "pass", "score": 8, "evidenceObservationIds": ["obs.candidate.song.portrait.01"], "evidence": "服装层次和低装饰度符合已批准的宋韵妆造状态。" },
    { "dimensionId": "palette", "status": "pass", "score": 8, "evidenceObservationIds": ["obs.candidate.song.portrait.01"], "evidence": "青瓷、月白、茶褐和暖肤色关系稳定。" },
    { "dimensionId": "character_identity", "status": "pass", "score": 9, "evidenceObservationIds": ["obs.candidate.song.portrait.01"], "evidence": "候选图未改变 CharacterSpec 的眼型、脸型和稳定识别点。" },
    { "dimensionId": "reference_contamination", "status": "warn", "score": 6, "evidenceObservationIds": ["obs.candidate.song.portrait.01"], "evidence": "背景局部借用了参考图的庭院结构，应在下一版明确排除具体布局。", "drift": "参考图的环境内容泄漏", "smallestRepairVariable": "environment_reference_scope" }
  ],
  "decision": { "nextAction": "conditional", "reason": "风格主要维度通过，但需要收窄环境参考范围后再用于跨场景复用。", "smallestRepairVariable": "environment_reference_scope", "stopCondition": "修复版不再复制参考图的具体建筑布局。" },
  "validation": { "evidenceScoped": true, "identityPreserved": true, "rightsChecked": true, "temporalChecked": true, "noProviderClaim": true },
  "skillReceipt": { "repository": "https://github.com/owner/repository", "ref": "v2.0.0", "commit": "0123456789abcdef0123456789abcdef01234567", "contentHash": "sha256:dddddddddddddddddddddddddddddddddddddddddddddddddddddddddddddddd", "installedBy": "codex-environment", "usedAt": "2026-08-20T12:00:00.000Z" }
}
